
Crash handler called, signal SIGABRT (6, 0xfffffffa)

Register dump
============

R0:  0x00000000      FP:   0xbeaca944
R1:  0x000003f4      IP:   0x40945bec
R2:  0x00000006      SP:   0xbeaca658
R3:  0x40022530      LR:   0x4084a2d4
R4:  0x000003f4      PC:   0x4084a308
R5:  0x00000006      CPSR: 0x20000010
R6:  0x40945000
R7:  0x0000010c
R8:  0x40022090
R9:  0x40022530
R10: 0x00000bec

Memory map
==========

00008000-00365000 r-xp 00000000 1f:05 6636172    /opt/ipaccess/3GCtrlApp/3gcntrlapp.exe.563.21.2
0036c000-00372000 rw-p 0035c000 1f:05 6636172    /opt/ipaccess/3GCtrlApp/3gcntrlapp.exe.563.21.2
00372000-00486000 rw-p 00000000 00:00 0          [heap]
40000000-4001d000 r-xp 00000000 1f:05 1412376    /lib/ld-2.8.so
4001d000-40024000 rw-p 00000000 00:00 0 
40024000-40025000 r--p 0001c000 1f:05 1412376    /lib/ld-2.8.so
40025000-40026000 rw-p 0001d000 1f:05 1412376    /lib/ld-2.8.so
40028000-4002e000 r-xp 00000000 1f:05 13110816   /opt/ipaccess/lib/libpmsysagent2.so.0.563.21.2
4002e000-40035000 ---p 00006000 1f:05 13110816   /opt/ipaccess/lib/libpmsysagent2.so.0.563.21.2
40035000-40036000 rw-p 00005000 1f:05 13110816   /opt/ipaccess/lib/libpmsysagent2.so.0.563.21.2
40038000-4005d000 r-xp 00000000 1f:05 16176868   /opt/ipaccess/lib/libsysfrmwk.so.0.563.21.2
4005d000-40064000 ---p 00025000 1f:05 16176868   /opt/ipaccess/lib/libsysfrmwk.so.0.563.21.2
40064000-40065000 rw-p 00024000 1f:05 16176868   /opt/ipaccess/lib/libsysfrmwk.so.0.563.21.2
40068000-40127000 r-xp 00000000 1f:05 1499552    /lib/libasn1code.so
40127000-4012f000 ---p 000bf000 1f:05 1499552    /lib/libasn1code.so
4012f000-40132000 rw-p 000bf000 1f:05 1499552    /lib/libasn1code.so
40134000-401d8000 r-xp 00000000 1f:05 3013568    /lib/libm-2.8.so
401d8000-401df000 ---p 000a4000 1f:05 3013568    /lib/libm-2.8.so
401df000-401e0000 r--p 000a3000 1f:05 3013568    /lib/libm-2.8.so
401e0000-401e1000 rw-p 000a4000 1f:05 3013568    /lib/libm-2.8.so
401e4000-401f6000 r-xp 00000000 1f:05 3563684    /lib/libnsl-2.8.so
401f6000-401fd000 ---p 00012000 1f:05 3563684    /lib/libnsl-2.8.so
401fd000-401fe000 r--p 00011000 1f:05 3563684    /lib/libnsl-2.8.so
401fe000-401ff000 rw-p 00012000 1f:05 3563684    /lib/libnsl-2.8.so
401ff000-40201000 rw-p 00000000 00:00 0 
40204000-40206000 r-xp 00000000 1f:05 2763936    /lib/libdl-2.8.so
40206000-4020d000 ---p 00002000 1f:05 2763936    /lib/libdl-2.8.so
4020d000-4020e000 r--p 00001000 1f:05 2763936    /lib/libdl-2.8.so
4020e000-4020f000 rw-p 00002000 1f:05 2763936    /lib/libdl-2.8.so
40210000-40213000 r-xp 00000000 1f:05 11961872   /opt/ipaccess/lib/libcrash.so.0.563.21.2
40213000-4021b000 ---p 00003000 1f:05 11961872   /opt/ipaccess/lib/libcrash.so.0.563.21.2
4021b000-4021c000 rw-p 00003000 1f:05 11961872   /opt/ipaccess/lib/libcrash.so.0.563.21.2
4021c000-402ad000 r-xp 00000000 1f:05 16384748   /opt/ipaccess/lib/libursl.so.0.563.21.2
402ad000-402b5000 ---p 00091000 1f:05 16384748   /opt/ipaccess/lib/libursl.so.0.563.21.2
402b5000-402b7000 rw-p 00091000 1f:05 16384748   /opt/ipaccess/lib/libursl.so.0.563.21.2
402b8000-405c2000 r-xp 00000000 1f:05 13967828   /opt/ipaccess/lib/librrmcc.so.0.563.21.2
405c2000-405c9000 ---p 0030a000 1f:05 13967828   /opt/ipaccess/lib/librrmcc.so.0.563.21.2
405c9000-405d1000 rw-p 00309000 1f:05 13967828   /opt/ipaccess/lib/librrmcc.so.0.563.21.2
405d4000-406c1000 r-xp 00000000 1f:05 15337424   /opt/ipaccess/lib/librrmcsc.so.0.563.21.2
406c1000-406c9000 ---p 000ed000 1f:05 15337424   /opt/ipaccess/lib/librrmcsc.so.0.563.21.2
406c9000-406cc000 rw-p 000ed000 1f:05 15337424   /opt/ipaccess/lib/librrmcsc.so.0.563.21.2
406cc000-406dc000 r-xp 00000000 1f:05 11929376   /opt/ipaccess/lib/libcellbcsc.so.0.563.21.2
406dc000-406e3000 ---p 00010000 1f:05 11929376   /opt/ipaccess/lib/libcellbcsc.so.0.563.21.2
406e3000-406e4000 rw-p 0000f000 1f:05 11929376   /opt/ipaccess/lib/libcellbcsc.so.0.563.21.2
406e4000-406fd000 r-xp 00000000 1f:05 16227692   /opt/ipaccess/lib/libupccsiw.so.0.563.21.2
406fd000-40704000 ---p 00019000 1f:05 16227692   /opt/ipaccess/lib/libupccsiw.so.0.563.21.2
40704000-40705000 rw-p 00018000 1f:05 16227692   /opt/ipaccess/lib/libupccsiw.so.0.563.21.2
40708000-40725000 r-xp 00000000 1f:05 16264872   /opt/ipaccess/lib/libupcpsiw.so.0.563.21.2
40725000-4072c000 ---p 0001d000 1f:05 16264872   /opt/ipaccess/lib/libupcpsiw.so.0.563.21.2
4072c000-4072d000 rw-p 0001c000 1f:05 16264872   /opt/ipaccess/lib/libupcpsiw.so.0.563.21.2
40730000-40734000 r-xp 00000000 1f:05 11922360   /opt/ipaccess/lib/libccpsiw.so.0.563.21.2
40734000-4073b000 ---p 00004000 1f:05 11922360   /opt/ipaccess/lib/libccpsiw.so.0.563.21.2
4073b000-4073c000 rw-p 00003000 1f:05 11922360   /opt/ipaccess/lib/libccpsiw.so.0.563.21.2
4073c000-4074c000 r-xp 00000000 1f:05 15681984   /opt/ipaccess/lib/librrmsme.so.0.563.21.2
4074c000-40753000 ---p 00010000 1f:05 15681984   /opt/ipaccess/lib/librrmsme.so.0.563.21.2
40753000-40754000 rw-p 0000f000 1f:05 15681984   /opt/ipaccess/lib/librrmsme.so.0.563.21.2
40754000-40759000 r-xp 00000000 1f:05 12531816   /opt/ipaccess/lib/libcsiwrrm.so.0.563.21.2
40759000-40761000 ---p 00005000 1f:05 12531816   /opt/ipaccess/lib/libcsiwrrm.so.0.563.21.2
40761000-40762000 rw-p 00005000 1f:05 12531816   /opt/ipaccess/lib/libcsiwrrm.so.0.563.21.2
40764000-4076c000 r-xp 00000000 1f:05 15666296   /opt/ipaccess/lib/librrmpsiw.so.0.563.21.2
4076c000-40773000 ---p 00008000 1f:05 15666296   /opt/ipaccess/lib/librrmpsiw.so.0.563.21.2
40773000-40774000 rw-p 00007000 1f:05 15666296   /opt/ipaccess/lib/librrmpsiw.so.0.563.21.2
40774000-4078b000 r-xp 00000000 1f:05 16302460   /opt/ipaccess/lib/libupctraffic.so.0.563.21.2
4078b000-40792000 ---p 00017000 1f:05 16302460   /opt/ipaccess/lib/libupctraffic.so.0.563.21.2
40792000-40793000 rw-p 00016000 1f:05 16302460   /opt/ipaccess/lib/libupctraffic.so.0.563.21.2
40794000-407b4000 r-xp 00000000 1f:05 16341172   /opt/ipaccess/lib/libupcuplstats.so.0.563.21.2
407b4000-407bb000 ---p 00020000 1f:05 16341172   /opt/ipaccess/lib/libupcuplstats.so.0.563.21.2
407bb000-407bc000 rw-p 0001f000 1f:05 16341172   /opt/ipaccess/lib/libupcuplstats.so.0.563.21.2
407bc000-407f5000 r-xp 00000000 1f:05 15894120   /opt/ipaccess/lib/libsoip.so.0.563.21.2
407f5000-407fc000 ---p 00039000 1f:05 15894120   /opt/ipaccess/lib/libsoip.so.0.563.21.2
407fc000-407fe000 rw-p 00038000 1f:05 15894120   /opt/ipaccess/lib/libsoip.so.0.563.21.2
40800000-40814000 r-xp 00000000 1f:05 3818916    /lib/libpthread-2.8.so
40814000-4081b000 ---p 00014000 1f:05 3818916    /lib/libpthread-2.8.so
4081b000-4081c000 r--p 00013000 1f:05 3818916    /lib/libpthread-2.8.so
4081c000-4081d000 rw-p 00014000 1f:05 3818916    /lib/libpthread-2.8.so
4081d000-4081f000 rw-p 00000000 00:00 0 
40820000-4093b000 r-xp 00000000 1f:05 1959164    /lib/libc-2.8.so
4093b000-40943000 ---p 0011b000 1f:05 1959164    /lib/libc-2.8.so
40943000-40945000 r--p 0011b000 1f:05 1959164    /lib/libc-2.8.so
40945000-40946000 rw-p 0011d000 1f:05 1959164    /lib/libc-2.8.so
40946000-40949000 rw-p 00000000 00:00 0 
4094c000-40958000 r-xp 00000000 1f:05 2854056    /lib/libgcc_s.so.1
40958000-4095f000 ---p 0000c000 1f:05 2854056    /lib/libgcc_s.so.1
4095f000-40960000 rw-p 0000b000 1f:05 2854056    /lib/libgcc_s.so.1
40960000-40961000 ---p 00000000 00:00 0 
40961000-41160000 rwxp 00000000 00:00 0 
41160000-41289000 rw-p 00000000 00:00 0 
beaaa000-beacb000 rwxp 00000000 00:00 0          [stack]

Code dump around crash
======================

0x4084a288: 0xe1833001 0x13a0c000 0x03a0c201 0xe1a00005 0xe28d108c 0xe1a0200d 0xe5043088 0xe58dc110 
0x4084a2a8: 0xeb0000b2 0xe3500000 0xb3e00000 0xa59d0000 0xeaffffe0 0x000fade0 0x000faf5c 0x00002ed0 
0x4084a2c8: 0xe92d40b0 0xe1a05000 0xebffac5a 0xe5104458 0xe1a03000 0xe3540000 0xe5100454 0x1a00001d 
0x4084a2e8: 0xe3a070e0 0xef000000 0xe1a04000 0xe5030458 0xe1a02005 0xe1a01004 0xe3a07f43 0xef000000 
0x4084a308: 0xe3700a01 0xe1a02000 0x8a000003 0xe3700001 0x0a000006 0xe1a00002 0xe8bd80b0 0xe59f3084 
0x4084a328: 0xebffac44 0xe79f3003 0xe2622000 0xe7802003 0xe59f3074 0xebffac3f 0xe79f3003 0xe7902003 
0x4084a348: 0xe1a0c000 0xe3520026 0x0a000009 0xe3e02000 0xe1a00002 0xe8bd80b0 0xe3500000 0xcaffffe3 
0x4084a368: 0xe3c03102 0xe3530000 0x01a00004 0x12600000 0xeaffffde 0xe1a01005 0xe1a00004 0xe3a070ee 

Stack dump at crash
===================

0xbeaca558: 0x0044e440 0x00000032 0x003d6830 0x00000000 0x00000000 0x00000000 0x00000032 0x00000008 
0xbeaca578: 0x003ad220 0x00000000 0x00000000 0x407fd36c 0x003d7a40 0x003d6830 0x00000005 0x00444138 
0xbeaca598: 0x00000000 0x00000000 0x407fd36c 0x407f08a8 0xbeaca5c4 0x00156c1c 0x0044ec68 0x4005c5cc 
0xbeaca5b8: 0x400646ec 0x4005a92c 0x40021790 0x00000016 0x408220e4 0x00000019 0x00000000 0x400095f8 
0xbeaca5d8: 0x400646ec 0x40025618 0x4001a964 0x0000001d 0xbeaca5f8 0xbeaca6ec 0x00788f6b 0x40823a1c 
0xbeaca5f8: 0x00000000 0x00000000 0x00000001 0x00000000 0x40945000 0x00000000 0x40945ff0 0x40945000 
0xbeaca618: 0x00000000 0x40887afc 0x40945728 0x00000ff0 0x00000000 0x00000001 0x40887368 0x00000000 
0xbeaca638: 0x00000000 0x00000000 0xbeaca714 0x00000001 0xbeaca6f8 0x40945000 0x00000000 0x40022090 
0xbeaca658: 0x00000001 0x40945bec 0x40945bec 0x4084e770 0x305b3a59 0x00000050 0xffff3b24 0x5b3a4e45 
0xbeaca678: 0x0a5d3832 0x40025000 0x40025878 0xbeaca734 0x400256c0 0x20202020 0x20202020 0x20202020 
0xbeaca698: 0x20202020 0x20202020 0x20202020 0x20202020 0x20202020 0x4f434950 0x30444820 0x534d0a3a 
0xbeaca6b8: 0x5a495347 0x305b3a45 0x52540a5d 0x5b3a4449 0x408104f8 0x409455e8 0x00000000 0x00000000 
0xbeaca6d8: 0x000000f7 0x40023000 0x4082588c 0x40020f70 0x000000f7 0x00679694 0x00000001 0x400217c0 
0xbeaca6f8: 0x00000020 0x00000000 0x00000000 0x00000000 0x00000000 0x00000000 0x00000000 0x00000000 
0xbeaca718: 0x00000000 0x00000000 0x00000000 0x00000000 0x00000000 0x00000000 0x00000000 0x00000000 
0xbeaca738: 0x00000000 0x00000000 0x00000000 0x00000000 0x00000000 0x00000000 0x00000000 0x00000000 
0xbeaca758: 0x00000000 0x00000000 0x00000000 0x00000000 0x00000000 0x00000000 0x00000000 0x00000000 
0xbeaca778: 0x00000000 0x4950410a 0x52444820 0x45560a3a 0x4f495352 0x305b3a4e 0x52460a5d 0x5b3a4d4f 
0xbeaca798: 0x5d323031 0x3a4f540a 0x3330315b 0x20200a5d 0x20202020 0x20202020 0x20202020 0x20202020 
0xbeaca7b8: 0x20202020 0x20202020 0x20202020 0x41202020 0x5b3a4950 0x0a5d3432 0x4952502c 0x5449524f 
0xbeaca7d8: 0x305b3a59 0x41500a5d 0x4c4d4152 0x5b3a4e45 0x0a5d3832 0x4c594150 0x4c44414f 0x5b3a4e45 
0xbeaca7f8: 0x200a5d30 0x20202020 0x20202020 0x20202020 0x20202020 0x20202020 0x20202020 0x20202020 
0xbeaca818: 0x20202020 0x4f434950 0x52444820 0x534d0a3a 0x5a495347 0x305b3a45 0x52540a5d 0x5b3a4449 
0xbeaca838: 0x38333231 0x4d0a5d34 0x44494753 0x34325b3a 0x534d0a5d 0x50595447 0x305b3a45 0x45440a5d 
0xbeaca858: 0x45444f43 0x54415453 0x5b3a5355 0x5d373832 0x00000000 0x00000000 0x00000000 0x00000000 
0xbeaca878: 0x00000000 0xbeaca894 0x00000000 0x0000011f 0x0040fa50 0x00162ca4 0x00355410 0x00000000 
0xbeaca898: 0x00000066 0x00000067 0x00000018 0x00000000 0x0000001c 0x00000000 0x00000000 0x00003060 
0xbeaca8b8: 0x00000018 0x00000000 0x0000011f 0x003d05b0 0x001565e0 0x00000000 0x00000000 0x00000000 
0xbeaca8d8: 0x00000000 0x00000000 0x00668500 0x00180067 0xbeaca900 0x0000001c 0x00000000 0x00000000 
0xbeaca8f8: 0x00448550 0x003e7e78 0x003f6c28 0x00000000 0xbeaca934 0x00156590 0x00000000 0xbeaca93c 
0xbeaca918: 0x003d85a0 0x0029aa58 0xbeaca934 0x00156338 0x00000000 0x003f7318 0x00000000 0x00000004 
0xbeaca938: 0x000adc68 0x52792a93 0x00047db1 0x003e7e78 0x003f6c28 0x00158928 0x0039c1e8 0x0039c1f8 
0xbeaca958: 0x0039c1dc 0x003d85a0 0x0039c1e0 0x0039c1e8 0x00000000 0x40025000 0x00000000 0x000105c0 
0xbeaca978: 0x00000000 0x00000000 0x5f000a31 0x42414e45 0x0000454c 0x72746e6f 0x6e456c6f 0x656c6261 
0xbeaca998: 0x00000064 0x23232323 0x23232323 0x23232323 0x23232323 0x00002323 0x00000000 0x00000000 
0xbeaca9b8: 0x00000000 0x00000000 0x00000000 0x00000000 0x00000000 0x00000000 0x00000000 0x00000000 
0xbeaca9d8: 0x00000000 0x00000000 0x00000000 0x00000000 0x00000000 0x00000000 0x00000000 0x00000000 
0xbeaca9f8: 0x00000000 0x00000000 0x00000000 0x00000000 0x00000000 0x00000000 0x00000000 0x00000000 
0xbeacaa18: 0x00000000 0x00000000 0x00000000 0x00000000 0x00000000 0x00000000 0x00000000 0x00000000 
0xbeacaa38: 0x00000000 0x00000000 0x00000000 0x00000000 0x00000000                                                                                                                                                                                                                                                                                                                                                                                                                                                                                                                                                                                                                                                                                                                                                                                                                                                                                                                                                                                                                                                                                                                                                                                                                                                                                                                                                                                                                                                                                                                                                                                                                                                                                                                                                                                                                                                                                                                                                                                                                                                                                                                                                                                                                                                                                                                                                                                                                                                                                                                                                                                                                                                                                                                                                                                                                                                                                                                                                                                                                                                                                                                                                                                                                                                                                                                                                                                                                                                                                                                                                                                                                                                                                                                                                                                                                                                                                                                                                                                                                                                                                                                                                                                                                                                                  0x425f4c52 0x5f455341 0x56524553 0x683d5245 0x73707474 0x662f2f3a 0x6f746d65 
0xbeacaf78: 0x6c6c6563 0x7269772e 0x73656c65 0x74612e73 0x6f632e74 0x34343a6d 0x69662f33 0x002f656c 
0xbeacaf98: 0x4c454853 0x622f3d4c 0x732f6e69 0x53460068 0x5241565f 0x544e4149 0x3432323d 0x57500046 
0xbeacafb8: 0x6f2f3d44 0x692f7470 0x63636170 0x2f737365 0x74434733 0x70416c72 0x4f430070 0x53494d4d 
0xbeacafd8: 0x4e4f4953 0x5f474e49 0x45444f4d 0x5400303d 0x2e003d5a 0x6367332f 0x6c72746e 0x2e707061 
0xbeacaff8: 0x00657865 0x00000000 



Stack unwind
============

---------------------------------------------------------------------------------------------------
 Function   Return    Frame
 Address    Address   Pointer
0x003e7e78 0x00047db1 0xbeaca944

 Parameters:
None found

 Stack dump:
0xbeaca848: 0x534d0a5d 0x50595447 0x305b3a45 0x45440a5d 0x45444f43 0x54415453 0x5b3a5355 0x5d373832 
0xbeaca868: 0x00000000 0x00000000 0x00000000 0x00000000 0x00000000 0xbeaca894 0x00000000 0x0000011f 
0xbeaca888: 0x0040fa50 0x00162ca4 0x00355410 0x00000000 0x00000066 0x00000067 0x00000018 0x00000000 
0xbeaca8a8: 0x0000001c 0x00000000 0x00000000 0x00003060 0x00000018 0x00000000 0x0000011f 0x003d05b0 
0xbeaca8c8: 0x001565e0 0x00000000 0x00000000 0x00000000 0x00000000 0x00000000 0x00668500 0x00180067 
0xbeaca8e8: 0xbeaca900 0x0000001c 0x00000000 0x00000000 0x00448550 0x003e7e78 0x003f6c28 0x00000000 
0xbeaca908: 0xbeaca934 0x00156590 0x00000000 0xbeaca93c 0x003d85a0 0x0029aa58 0xbeaca934 0x00156338 
0xbeaca928: 0x00000000 0x003f7318 0x00000000 0x00000004 0x000adc68 0x52792a93 0x00047db1 0x003e7e78 
---------------------------------------------------------------------------------------------------
 Function   Return    Frame
 Address    Address   Pointer
0x12633008 0x03e03000 0x000adc68

 Parameters:

Signal SIGSEGV (11, 0x00000001) occurred in Crash Handler :-(

Aborting crash dump

