
Crash handler called, signal SIGABRT (6, 0xfffffffa)

Register dump
============

R0:  0x00000000      FP:   0x00000701
R1:  0x0000042a      IP:   0x00000002
R2:  0x00000006      SP:   0x4aeb1b70
R3:  0x4aeb2930      LR:   0x405a62d4
R4:  0x0000042a      PC:   0x405a6308
R5:  0x00000006      CPSR: 0x20000010
R6:  0x406a1000
R7:  0x0000010c
R8:  0x4aeb2490
R9:  0x4aeb2930
R10: 0x00000bec

Memory map
==========

00008000-0016c000 r-xp 00000000 1f:05 8996560    /opt/ipaccess/MgrApp/ipa-mgr_app.563.21.2
00173000-0019b000 rw-p 00163000 1f:05 8996560    /opt/ipaccess/MgrApp/ipa-mgr_app.563.21.2
0019b000-00837000 rw-p 00000000 00:00 0          [heap]
40000000-4001d000 r-xp 00000000 1f:05 1412376    /lib/ld-2.8.so
4001d000-40024000 rw-p 00000000 00:00 0 
40024000-40025000 r--p 0001c000 1f:05 1412376    /lib/ld-2.8.so
40025000-40026000 rw-p 0001d000 1f:05 1412376    /lib/ld-2.8.so
40026000-40028000 rw-p 00000000 00:00 0 
40028000-4002d000 r-xp 00000000 1f:05 11894948   /opt/ipaccess/lib/libcbctrl_db.so.0.563.21.2
4002d000-40034000 ---p 00005000 1f:05 11894948   /opt/ipaccess/lib/libcbctrl_db.so.0.563.21.2
40034000-40035000 rw-p 00004000 1f:05 11894948   /opt/ipaccess/lib/libcbctrl_db.so.0.563.21.2
40035000-40037000 rw-p 00000000 00:00 0 
40038000-40041000 r-xp 00000000 1f:05 11905088   /opt/ipaccess/lib/libcbctrl_sabp.so.0.563.21.2
40041000-40048000 ---p 00009000 1f:05 11905088   /opt/ipaccess/lib/libcbctrl_sabp.so.0.563.21.2
40048000-40049000 rw-p 00008000 1f:05 11905088   /opt/ipaccess/lib/libcbctrl_sabp.so.0.563.21.2
4004c000-4005f000 r-xp 00000000 1f:05 11869880   /opt/ipaccess/lib/libbsmis2.so.0.563.21.2
4005f000-40067000 ---p 00013000 1f:05 11869880   /opt/ipaccess/lib/libbsmis2.so.0.563.21.2
40067000-40069000 rw-p 00013000 1f:05 11869880   /opt/ipaccess/lib/libbsmis2.so.0.563.21.2
4006c000-40072000 r-xp 00000000 1f:05 13012884   /opt/ipaccess/lib/liboamclient2.so.0.563.21.2
40072000-40079000 ---p 00006000 1f:05 13012884   /opt/ipaccess/lib/liboamclient2.so.0.563.21.2
40079000-4007a000 rw-p 00005000 1f:05 13012884   /opt/ipaccess/lib/liboamclient2.so.0.563.21.2
4007c000-4008b000 r-xp 00000000 1f:05 11846712   /opt/ipaccess/lib/libapdiag.so.0.563.21.2
4008b000-40092000 ---p 0000f000 1f:05 11846712   /opt/ipaccess/lib/libapdiag.so.0.563.21.2
40092000-40093000 rw-p 0000e000 1f:05 11846712   /opt/ipaccess/lib/libapdiag.so.0.563.21.2
40094000-4009a000 r-xp 00000000 1f:05 13110816   /opt/ipaccess/lib/libpmsysagent2.so.0.563.21.2
4009a000-400a1000 ---p 00006000 1f:05 13110816   /opt/ipaccess/lib/libpmsysagent2.so.0.563.21.2
400a1000-400a2000 rw-p 00005000 1f:05 13110816   /opt/ipaccess/lib/libpmsysagent2.so.0.563.21.2
400a4000-400c9000 r-xp 00000000 1f:05 16176868   /opt/ipaccess/lib/libsysfrmwk.so.0.563.21.2
400c9000-400d0000 ---p 00025000 1f:05 16176868   /opt/ipaccess/lib/libsysfrmwk.so.0.563.21.2
400d0000-400d1000 rw-p 00024000 1f:05 16176868   /opt/ipaccess/lib/libsysfrmwk.so.0.563.21.2
400d4000-400d7000 r-xp 00000000 1f:05 11961872   /opt/ipaccess/lib/libcrash.so.0.563.21.2
400d7000-400df000 ---p 00003000 1f:05 11961872   /opt/ipaccess/lib/libcrash.so.0.563.21.2
400df000-400e0000 rw-p 00003000 1f:05 11961872   /opt/ipaccess/lib/libcrash.so.0.563.21.2
400e0000-40119000 r-xp 00000000 1f:05 15894120   /opt/ipaccess/lib/libsoip.so.0.563.21.2
40119000-40120000 ---p 00039000 1f:05 15894120   /opt/ipaccess/lib/libsoip.so.0.563.21.2
40120000-40122000 rw-p 00038000 1f:05 15894120   /opt/ipaccess/lib/libsoip.so.0.563.21.2
40124000-4012f000 r-xp 00000000 1f:05 12643944   /opt/ipaccess/lib/libigki.so.0.563.21.2
4012f000-40137000 ---p 0000b000 1f:05 12643944   /opt/ipaccess/lib/libigki.so.0.563.21.2
40137000-40138000 rw-p 0000b000 1f:05 12643944   /opt/ipaccess/lib/libigki.so.0.563.21.2
40138000-4013c000 r-xp 00000000 1f:05 11952636   /opt/ipaccess/lib/libcfutil.so.0.563.21.2
4013c000-40143000 ---p 00004000 1f:05 11952636   /opt/ipaccess/lib/libcfutil.so.0.563.21.2
40143000-40144000 rw-p 00003000 1f:05 11952636   /opt/ipaccess/lib/libcfutil.so.0.563.21.2
40144000-4017c000 r-xp 00000000 1f:05 15987648   /opt/ipaccess/lib/libssl.so.0.9.8
4017c000-4017f000 rw-p 00038000 1f:05 15987648   /opt/ipaccess/lib/libssl.so.0.9.8
40180000-40285000 r-xp 00000000 1f:05 11969096   /opt/ipaccess/lib/libcrypto.so.0.9.8
40285000-4028d000 ---p 00105000 1f:05 11969096   /opt/ipaccess/lib/libcrypto.so.0.9.8
4028d000-402a0000 rw-p 00105000 1f:05 11969096   /opt/ipaccess/lib/libcrypto.so.0.9.8
402a0000-402a3000 rw-p 00000000 00:00 0 
402a4000-402c6000 r-xp 00000000 1f:05 13020740   /opt/ipaccess/lib/libpcre.so.0.0.1
402c6000-402cd000 ---p 00022000 1f:05 13020740   /opt/ipaccess/lib/libpcre.so.0.0.1
402cd000-402ce000 rw-p 00021000 1f:05 13020740   /opt/ipaccess/lib/libpcre.so.0.0.1
402d0000-402dd000 r-xp 00000000 1f:05 16149140   /opt/ipaccess/lib/libsslutils.so.0.563.21.2
402dd000-402e4000 ---p 0000d000 1f:05 16149140   /opt/ipaccess/lib/libsslutils.so.0.563.21.2
402e4000-402e5000 rw-p 0000c000 1f:05 16149140   /opt/ipaccess/lib/libsslutils.so.0.563.21.2
402e8000-402ec000 r-xp 00000000 1f:05 16108280   /opt/ipaccess/lib/libsslcrypto-cisco.so.482.0
402ec000-402f3000 ---p 00004000 1f:05 16108280   /opt/ipaccess/lib/libsslcrypto-cisco.so.482.0
402f3000-402f6000 rw-p 00003000 1f:05 16108280   /opt/ipaccess/lib/libsslcrypto-cisco.so.482.0
402f8000-40353000 r-xp 00000000 1f:05 16590192   /opt/ipaccess/lib/libxml2.so.2.7.3
40353000-4035b000 ---p 0005b000 1f:05 16590192   /opt/ipaccess/lib/libxml2.so.2.7.3
4035b000-4035c000 rw-p 0005b000 1f:05 16590192   /opt/ipaccess/lib/libxml2.so.2.7.3
4035c000-403c5000 r-xp 00000000 1f:05 12837532   /opt/ipaccess/lib/liboam_msl.so.0.563.21.2
403c5000-403cc000 ---p 00069000 1f:05 12837532   /opt/ipaccess/lib/liboam_msl.so.0.563.21.2
403cc000-403f8000 rw-p 00068000 1f:05 12837532   /opt/ipaccess/lib/liboam_msl.so.0.563.21.2
403f8000-403fe000 r-xp 00000000 1f:05 12825952   /opt/ipaccess/lib/liboam_mml.so.0.563.21.2
403fe000-40406000 ---p 00006000 1f:05 12825952   /opt/ipaccess/lib/liboam_mml.so.0.563.21.2
40406000-40407000 rw-p 00006000 1f:05 12825952   /opt/ipaccess/lib/liboam_mml.so.0.563.21.2
40408000-40415000 r-xp 00000000 1f:05 12989416   /opt/ipaccess/lib/liboam_xmlif.so.0.563.21.2
40415000-4041d000 ---p 0000d000 1f:05 12989416   /opt/ipaccess/lib/liboam_xmlif.so.0.563.21.2
4041d000-4041e000 rw-p 0000d000 1f:05 12989416   /opt/ipaccess/lib/liboam_xmlif.so.0.563.21.2
40420000-40453000 r-xp 00000000 1f:05 15756692   /opt/ipaccess/lib/libsabp.so.0
40453000-4045a000 ---p 00033000 1f:05 15756692   /opt/ipaccess/lib/libsabp.so.0
4045a000-4045c000 rw-p 00032000 1f:05 15756692   /opt/ipaccess/lib/libsabp.so.0
4045c000-4045d000 rw-p 00000000 00:00 0 
40460000-40483000 r-xp 00000000 1f:05 15823504   /opt/ipaccess/lib/libsdgpioutil.so.0.563.21.2
40483000-4048b000 ---p 00023000 1f:05 15823504   /opt/ipaccess/lib/libsdgpioutil.so.0.563.21.2
4048b000-40490000 rw-p 00023000 1f:05 15823504   /opt/ipaccess/lib/libsdgpioutil.so.0.563.21.2
40490000-404a4000 r-xp 00000000 1f:05 3818916    /lib/libpthread-2.8.so
404a4000-404ab000 ---p 00014000 1f:05 3818916    /lib/libpthread-2.8.so
404ab000-404ac000 r--p 00013000 1f:05 3818916    /lib/libpthread-2.8.so
404ac000-404ad000 rw-p 00014000 1f:05 3818916    /lib/libpthread-2.8.so
404ad000-404af000 rw-p 00000000 00:00 0 
404b0000-40554000 r-xp 00000000 1f:05 3013568    /lib/libm-2.8.so
40554000-4055b000 ---p 000a4000 1f:05 3013568    /lib/libm-2.8.so
4055b000-4055c000 r--p 000a3000 1f:05 3013568    /lib/libm-2.8.so
4055c000-4055d000 rw-p 000a4000 1f:05 3013568    /lib/libm-2.8.so
40560000-40562000 r-xp 00000000 1f:05 1494620    /lib/libanl.so.1
40562000-40569000 ---p 00002000 1f:05 1494620    /lib/libanl.so.1
40569000-4056a000 r--p 00001000 1f:05 1494620    /lib/libanl.so.1
4056a000-4056b000 rw-p 00002000 1f:05 1494620    /lib/libanl.so.1
4056c000-40572000 r-xp 00000000 1f:05 3897888    /lib/librt-2.8.so
40572000-40579000 ---p 00006000 1f:05 3897888    /lib/librt-2.8.so
40579000-4057a000 r--p 00005000 1f:05 3897888    /lib/librt-2.8.so
4057a000-4057b000 rw-p 00006000 1f:05 3897888    /lib/librt-2.8.so
4057c000-40697000 r-xp 00000000 1f:05 1959164    /lib/libc-2.8.so
40697000-4069f000 ---p 0011b000 1f:05 1959164    /lib/libc-2.8.so
4069f000-406a1000 r--p 0011b000 1f:05 1959164    /lib/libc-2.8.so
406a1000-406a2000 rw-p 0011d000 1f:05 1959164    /lib/libc-2.8.so
406a2000-406a5000 rw-p 00000000 00:00 0 
406a8000-406aa000 r-xp 00000000 1f:05 2763936    /lib/libdl-2.8.so
406aa000-406b1000 ---p 00002000 1f:05 2763936    /lib/libdl-2.8.so
406b1000-406b2000 r--p 00001000 1f:05 2763936    /lib/libdl-2.8.so
406b2000-406b3000 rw-p 00002000 1f:05 2763936    /lib/libdl-2.8.so
406b3000-406b4000 ---p 00000000 00:00 0 
406b4000-40eb3000 rw-p 00000000 00:00 0 
40eb3000-40eb4000 ---p 00000000 00:00 0 
40eb4000-416b3000 rw-p 00000000 00:00 0 
416b3000-416b4000 ---p 00000000 00:00 0 
416b4000-41eb3000 rw-p 00000000 00:00 0 
41eb3000-41eb4000 ---p 00000000 00:00 0 
41eb4000-426b3000 rw-p 00000000 00:00 0 
426b3000-426b4000 ---p 00000000 00:00 0 
426b4000-42eb3000 rw-p 00000000 00:00 0 
42eb3000-42eb4000 ---p 00000000 00:00 0 
42eb4000-436b3000 rw-p 00000000 00:00 0 
436b3000-436b4000 ---p 00000000 00:00 0 
436b4000-43eb3000 rw-p 00000000 00:00 0 
43eb3000-43eb4000 ---p 00000000 00:00 0 
43eb4000-446b3000 rw-p 00000000 00:00 0 
446b3000-446b4000 ---p 00000000 00:00 0 
446b4000-44eb3000 rw-p 00000000 00:00 0 
44eb3000-44eb4000 ---p 00000000 00:00 0 
44eb4000-456b3000 rw-p 00000000 00:00 0 
456b3000-456b4000 ---p 00000000 00:00 0 
456b4000-45eb3000 rw-p 00000000 00:00 0 
45eb3000-45eb4000 ---p 00000000 00:00 0 
45eb4000-466b3000 rw-p 00000000 00:00 0 
466b3000-466b4000 ---p 00000000 00:00 0 
466b4000-46eb3000 rw-p 00000000 00:00 0 
46eb3000-46eb4000 ---p 00000000 00:00 0 
46eb4000-476b3000 rw-p 00000000 00:00 0 
476b3000-476b4000 ---p 00000000 00:00 0 
476b4000-47eb3000 rw-p 00000000 00:00 0 
47eb3000-47eb4000 ---p 00000000 00:00 0 
47eb4000-486b3000 rw-p 00000000 00:00 0 
486b3000-486b4000 ---p 00000000 00:00 0 
486b4000-48eb3000 rw-p 00000000 00:00 0 
48eb3000-48eb4000 ---p 00000000 00:00 0 
48eb4000-496b3000 rw-p 00000000 00:00 0 
496b3000-496b4000 ---p 00000000 00:00 0 
496b4000-49eb3000 rw-p 00000000 00:00 0 
49eb3000-49eb4000 ---p 00000000 00:00 0 
49eb4000-4a6b3000 rw-p 00000000 00:00 0 
4a6b3000-4a6b4000 ---p 00000000 00:00 0 
4a6b4000-4aeb3000 rw-p 00000000 00:00 0 
4aeb3000-4aeb4000 ---p 00000000 00:00 0 
4aeb4000-4b6b3000 rw-p 00000000 00:00 0 
4b6b3000-4b6b4000 ---p 00000000 00:00 0 
4b6b4000-4beb3000 rw-p 00000000 00:00 0 
4beb3000-4beb4000 ---p 00000000 00:00 0 
4beb4000-4c6b3000 rw-p 00000000 00:00 0 
4c6b3000-4c6b4000 ---p 00000000 00:00 0 
4c6b4000-4ceb3000 rw-p 00000000 00:00 0 
4ceb3000-4ceb4000 ---p 00000000 00:00 0 
4ceb4000-4d6b3000 rw-p 00000000 00:00 0 
4d6b3000-4d6b4000 ---p 00000000 00:00 0 
4d6b4000-4deb3000 rw-p 00000000 00:00 0 
4deb3000-4deb4000 ---p 00000000 00:00 0 
4deb4000-4e6b3000 rw-p 00000000 00:00 0 
4e6b4000-4e6b5000 rw-s 00000000 00:14 1455       /var/tmp/agc/shared
4e6b8000-4e6b9000 rw-s 00000000 00:04 32768      /SYSV52584353 (deleted)
4e6bc000-4e6d6000 rw-s 00000000 00:0d 1647       /tmp/cb_msg.dat
4e6d8000-4e6e1000 r-xp 00000000 1f:05 3637112    /lib/libnss_files-2.8.so
4e6e1000-4e6e8000 ---p 00009000 1f:05 3637112    /lib/libnss_files-2.8.so
4e6e8000-4e6e9000 r--p 00008000 1f:05 3637112    /lib/libnss_files-2.8.so
4e6e9000-4e6ea000 rw-p 00009000 1f:05 3637112    /lib/libnss_files-2.8.so
4e6ec000-4e6ef000 r-xp 00000000 1f:05 3627700    /lib/libnss_dns-2.8.so
4e6ef000-4e6f6000 ---p 00003000 1f:05 3627700    /lib/libnss_dns-2.8.so
4e6f6000-4e6f7000 r--p 00002000 1f:05 3627700    /lib/libnss_dns-2.8.so
4e6f7000-4e6f8000 rw-p 00003000 1f:05 3627700    /lib/libnss_dns-2.8.so
4e700000-4e725000 rw-p 00000000 00:00 0 
4e725000-4e800000 ---p 00000000 00:00 0 
4e800000-4e80e000 r-xp 00000000 1f:05 3858368    /lib/libresolv-2.8.so
4e80e000-4e815000 ---p 0000e000 1f:05 3858368    /lib/libresolv-2.8.so
4e815000-4e816000 r--p 0000d000 1f:05 3858368    /lib/libresolv-2.8.so
4e816000-4e817000 rw-p 0000e000 1f:05 3858368    /lib/libresolv-2.8.so
4e817000-4e819000 rw-p 00000000 00:00 0 
bea6a000-bea8b000 rw-p 00000000 00:00 0          [stack]

Code dump around crash
======================

0x405a6288: 0xe1833001 0x13a0c000 0x03a0c201 0xe1a00005 0xe28d108c 0xe1a0200d 0xe5043088 0xe58dc110 
0x405a62a8: 0xeb0000b2 0xe3500000 0xb3e00000 0xa59d0000 0xeaffffe0 0x000fade0 0x000faf5c 0x00002ed0 
0x405a62c8: 0xe92d40b0 0xe1a05000 0xebffac5a 0xe5104458 0xe1a03000 0xe3540000 0xe5100454 0x1a00001d 
0x405a62e8: 0xe3a070e0 0xef000000 0xe1a04000 0xe5030458 0xe1a02005 0xe1a01004 0xe3a07f43 0xef000000 
0x405a6308: 0xe3700a01 0xe1a02000 0x8a000003 0xe3700001 0x0a000006 0xe1a00002 0xe8bd80b0 0xe59f3084 
0x405a6328: 0xebffac44 0xe79f3003 0xe2622000 0xe7802003 0xe59f3074 0xebffac3f 0xe79f3003 0xe7902003 
0x405a6348: 0xe1a0c000 0xe3520026 0x0a000009 0xe3e02000 0xe1a00002 0xe8bd80b0 0xe3500000 0xcaffffe3 
0x405a6368: 0xe3c03102 0xe3530000 0x01a00004 0x12600000 0xeaffffde 0xe1a01005 0xe1a00004 0xe3a070ee 

Stack dump at crash
===================

0x4aeb1a70: 0x406a1000 0x00748630 0x406a203c 0x406a203c 0x0015d5a4 0x00000208 0x4aeb1b44 0x405e87d0 
0x4aeb1a90: 0x4068d850 0x406a123c 0x000000e8 0x00001030 0x0000001b 0x406a1000 0x000000d0 0x0000001b 
0x4aeb1ab0: 0x0001faa8 0x0000001b 0x000000e8 0x00000038 0x4068d850 0x00000000 0x0000096c 0x40026000 
0x4aeb1ad0: 0x406a15e8 0x40026000 0x0000096c 0x40632004 0x00000001 0x0000096c 0x40026000 0x40632020 
0x4aeb1af0: 0x40026000 0x405e16dc 0x00000000 0x406a15e8 0x0000096c 0x40026000 0x406a1ff0 0x405e13e0 
0x4aeb1b10: 0x00000000 0x00000000 0x00000001 0x00000000 0x406a1000 0x00000000 0x406a1ff0 0x406a1000 
0x4aeb1b30: 0x00000000 0x405e3afc 0x406a1728 0x00000ff0 0x00000000 0x00000001 0x405e3368 0x00000000 
0x4aeb1b50: 0x00000000 0x00000000 0x4aeb1c2c 0x00000001 0x4aeb1c10 0x406a1000 0x00000000 0x4aeb2490 
0x4aeb1b70: 0x00000001 0x406a1bec 0x406a1bec 0x405aa770 0x00167820 0x00000050 0xffff3b24 0x40137268 
0x4aeb1b90: 0x00000014 0x40025000 0x40025878 0x4aeb1c4c 0x400256c0 0x406a1000 0x4aeb2490 0x40137268 
0x4aeb1bb0: 0x00000040 0x0011fed4 0x00000002 0x003f297c 0x40137268 0x00000040 0x00000008 0x007019c0 
0x4aeb1bd0: 0x00173db0 0x40128708 0x406a203c 0x01500000 0x01500000 0x006fa168 0x40137268 0x00173db0 
0x4aeb1bf0: 0x4aeb1c68 0x00000214 0x4058188c 0x40021d38 0x00000154 0x00679694 0x00173db0 0x40022650 
0x4aeb1c10: 0x00000020 0x00000000 0x00000000 0x00000000 0x00000000 0x00000000 0x00000000 0x00000000 
0x4aeb1c30: 0x00000000 0x00000000 0x00000000 0x00000000 0x00000000 0x00000000 0x00000000 0x00000000 
0x4aeb1c50: 0x00000000 0x00000000 0x00000000 0x00000000 0x00000000 0x00000000 0x00000000 0x00000000 
0x4aeb1c70: 0x00000000 0x00000000 0x00000000 0x00000000 0x00000000 0x00000000 0x00000000 0x00000000 
0x4aeb1c90: 0x000010cb 0x0015dbe8 0x4aeb1cb0 0x00000002 0x00000050 0x00173da8 0x4aeb1dd4 0x000c24a8 
0x4aeb1cb0: 0x61746f54 0x6353206c 0x74206e61 0x20656d69 0x6b6f6f74 0x726f6d20 0x68742065 0x34206e61 
0x4aeb1cd0: 0x63657320 0x73646e6f 0x6261202c 0x6974726f 0x0000676e 0x00000000 0x00000000 0x00000000 
0x4aeb1cf0: 0x00000000 0x00000000 0x00000000 0x00000000 0x00000000 0x00000000 0x00000000 0x00000000 
0x4aeb1d10: 0x00000000 0x00000000 0x00000000 0x00000000 0x00000000 0x00000000 0x00000000 0x00000000 
0x4aeb1d30: 0x00000000 0x00000000 0x00000000 0x00000000 0x00000000 0x00000000 0x00000000 0x00000000 
0x4aeb1d50: 0x00000000 0x00000000 0x00000000 0x00000000 0x00000000 0x00000000 0x00000000 0x00000000 
0x4aeb1d70: 0x00000000 0x00000000 0x00000000 0x00000000 0x00000000 0x00000000 0x00000000 0x00000000 
0x4aeb1d90: 0x00000000 0x00000000 0x00000000 0x00000000 0x00000000 0x00000000 0x00000000 0x00000000 
0x4aeb1db0: 0x0015d5a4 0x000001eb 0x00000000 0x000c1d54 0x00000013 0x0015d880 0x000001eb 0x405e1680 
0x4aeb1dd0: 0x00000000 0x0034c7ce 0x0034c7d0 0x00000000 0xbea8aa88 0x000002ac 0x00000000 0x00173db0 
0x4aeb1df0: 0x40137268 0x00000013 0xbea8aa88 0x00000000 0xbea8aa88 0x401297e8 0x00000000 0x00000000 
0x4aeb1e10: 0x4aeb24d8 0x4aeb2490 0x40496558 0x00000152 0x003d0f00 0x40496604 0x404ac000 0x4aeb2490 
0x4aeb1e30: 0x4aeb24d8 0x4aeb2490 0x40496558 0x00000152 0x003d0f00 0xbea8aa88 0x00000000 0xbea8aa88 
0x4aeb1e50: 0x4aeb1e28 0x404965d0 0x00000000 0x00000000 0x00000000 0x00000000 0x00000000 0x00000000 
0x4aeb1e70: 0x00000000 0x00000000 0x00000000 0x00000000 0x00000000 0x00000000 0x00000000 0x00000000 
0x4aeb1e90: 0x00000000 0x00000000 0x00000000 0x00000000 0x00000000 0x00000000 0x00000000 0x00000000 
0x4aeb1eb0: 0x00000000 0x00000000 0x00000000 0x00000000 0x00000000 0x00000000 0x00000000 0x00000000 
0x4aeb1ed0: 0x00000000 0x00000000 0x00000000 0x00000000 0x00000000 0x00000000 0x00000000 0x00000000 
0x4aeb1ef0: 0x00000000 0x00000000 0x00000000 0x00000000 0x00000000 0x00000000 0x00000000 0x00000000 
0x4aeb1f10: 0x00000000 0x00000000 0x00000000 0x00000000 0x00000000 0x00000000 0x00000000 0x00000000 
0x4aeb1f30: 0x00000000 0x00000000 0x00000000 0x00000000 0x00000000 0x00000000 0x00000000 0x00000000 
0x4aeb1f50: 0x00000000 0x00000000 0x00000000 0x00000000 0x00000000 0x00000000 0x00000000 0x00000000 
0x4aeb1f70: 0x00000000 0x00000000 0x00000000 0x00000000 0x00000000 0x00000000 0x00000000 0x00000000 
0x4aeb1f90: 0x00000000 0x00000000 0x00000000 0x00000000 0x00000000 0x00000000 0x00000000 0x00000000 
0x4aeb1fb0: 0x00000000 0x00000000 0x00000000 0x00000000 0x00000000 0x00000000 0x00000000 0x4aeb24d8 
0x4aeb1fd0: 0x4aeb2490 0x40496558 0x00000078 0x003d0f00 0xbea8aa88 0x00000000 0xbea8aa88 0x40640908 
0x4aeb1ff0: 0x00000000 0x00000000 0x00000000 0x00000000 0x00000000 0x00000000 0x00000000 0x00000000 
0x4aeb2010: 0x00000000 0x00000000 0x00000000 0x00000000 0x00000000 0x00000000 0x00000000 0x00000000 
0x4aeb2030: 0x00000000 0x00000000 0x00000000 0x00000000 0x00000000 0x00000000 0x00000000 0x00000000 
0x4aeb2050: 0x00000000 0x00000000 0x00000000 0x00000000 0x00000000 0x00000000 0x00000000 0x00000000 
0x4aeb2070: 0x00000000 0x00000000 0x00000000 0x00000000 0x00000000 0x00000000 0x00000000 0x00000000 
0x4aeb2090: 0x00000000 0x00000000 0x00000000 0x00000000 0x00000000 0x00000000 0x00000000 0x00000000 
0x4aeb20b0: 0x00000000 0x00000000 0x00000000 0x00000000 0x00000000 0x00000000 0x00000000 0x00000000 
0x4aeb20d0: 0x00000000 0x00000000 0x00000000 0x00000000 0x00000000 0x00000000 0x00000000 0x00000000 
0x4aeb20f0: 0x00000000 0x00000000 0x00000000 0x00000000 0x00000000 0x00000000 0x00000000 0x00000000 
0x4aeb2110: 0x00000000 0x00000000 0x00000000 0x00000000 0x00000000 0x00000000 0x00000000 0x00000000 
0x4aeb2130: 0x00000000 0x00000000 0x00000000 0x00000000 0x00000000 0x00000000 0x00000000 0x00000000 
0x4aeb2150: 0x00000000 0x00000000 0x00000000 0x00000000 0x00000000 0x00000000 0x00000000 0x00000000 
0x4aeb2170: 0x00000000 0x00000000 0x00000000 0x00000000 0x00000000 0x00000000 0x00000000 0x00000000 
0x4aeb2190: 0x00000000 0x00000000 0x00000000 0x00000000 0x00000000 0x00000000 0x00000000 0x00000000 
0x4aeb21b0: 0x00000000 0x00000000 0x00000000 0x00000000 0x00000000 0x00000000 0x00000000 0x00000000 
0x4aeb21d0: 0x00000000 0x00000000 0x00000000 0x00000000 0x00000000 0x00000000 0x00000000 0x00000000 
0x4aeb21f0: 0x00000000 0x00000000 0x00000000 0x00000000 0x00000000 0x00000000 0x00000000 0x00000000 
0x4aeb2210: 0x00000000 0x00000000 0x00000000 0x00000000 0x00000000 0x00000000 0x00000000 0x00000000 
0x4aeb2230: 0x00000000 0x00000000 0x00000000 0x00000000 0x00000000 0x00000000 0x00000000 0x00000000 
0x4aeb2250: 0x00000000 0x00000000 0x00000000 0x00000000 0x00000000 0x00000000 0x00000000 0x00000000 
0x4aeb2270: 0x00000000 0x00000000 0x00000000 0x00000000 0x00000000 0x00000000 0x00000000 0x00000000 
0x4aeb2290: 0x00000000 0x00000000 0x00000000 0x00000000 0x00000000 0x00000000 0x00000000 0x00000000 
0x4aeb22b0: 0x00000000 0x00000000 0x00000000 0x00000000 0x00000000 0x00000000 0x00000000 0x00000000 
0x4aeb22d0: 0x00000000 0x00000000 0x00000000 0x00000000 0x00000000 0x00000000 0x00000000 0x00000000 
0x4aeb22f0: 0x00000000 0x00000000 0x00000000 0x00000000 0x00000000 0x00000000 0x00000000 0x00000000 
0x4aeb2310: 0x00000000 0x00000000 0x00000000 0x00000000 0x00000000 0x00000000 0x00000000 0x00000000 
0x4aeb2330: 0x00000000 0x00000000 0x00000000 0x00000000 0x00000000 0x00000000 0x00000000 0x00000000 
0x4aeb2350: 0x00000000 0x00000000 0x00000000 0x00000000 0x00000000 0x00000000 0x00000000 0x00000000 
0x4aeb2370: 0x00000000 0x00000000 0x00000000 0x00000000 0x00000000 0x00000000 0x00000000 0x00000000 
0x4aeb2390: 0x00000000 0x00000000 0x00000000 0x00000000 0x00000000 0x00000000 0x00000000 0x00000000 
0x4aeb23b0: 0x00000000 0x00000000 0x00000000 0x00000000 0x00000000 0x00000000 0x00000000 0x00000000 
0x4aeb23d0: 0x00000000 0x00000000 0x00000000 0x00000000 0x00000000 0x00000000 0x00000000 0x00000000 
0x4aeb23f0: 0x00000000 0x00000000 0x00000000 0x00000000 0x00000000 0x00000000 0x00000000 0x00000000 
0x4aeb2410: 0x00000000 0x00000000 0x00000000 0x00000000 0x00000000 0x00000000 0x00000000 0x00000000 
0x4aeb2430: 0x00000000 0x00000000 0x00000000 0x00000000 0x00000000 0x00000000 0x00000000 0x00000000 
0x4aeb2450: 0x00000000 0x00000000 0x00000000 0x00000000 0x00000000 0x00000000 0x00000000 0x00000000 
0x4aeb2470: 0x00000000 0x00000000 0x00000000 0x00000000 0x00000000 0x00000000 0x00000000 0x00000000 
0x4aeb2490: 0x00000001 0x00000000 0x00000080 0x00000000 0x00000000 0x00000000 0x00000000 0x00000000 
0x4aeb24b0: 0x00000000 0x00000000 0x00000000 0x00000000 0x00000000 0x00000000 0x00000000 0x00000000 
0x4aeb24d0: 0x4a6b24d0 0x4b6b24d0 0x0000042a 0x000003e1 0x4aeb24e0 0xffffffec 0x00000000 0x00000000 
0x4aeb24f0: 0x4aeb1e30 0x00000000 0x00000001 0x00000001 0x00000013 0x00000000 0x00000000 0x00000000 
0x4aeb2510: 0x00000000 0x00000000 0x00000000 0x00000000 0x00000000 0x00000000 0x00000000 0x00000000 
0x4aeb2530: 0x00000000 0x00000000 0x00000000 0x00000000 0x00000000 0x00000000 0x00000000 0x00000000 
0x4aeb2550: 0x00000000 0x00000000 0x00000000 0x00000000 0x00000000 0x00000000 0x00000000 0x00000000 
0x4aeb2570: 0x00000000 0x00000000 0x00000000 0x00000000 0x00000000 0x00000000 0x00000000 0x00000000 
0x4aeb2590: 0x00000000 0x00000000 0x00000000 0x00000000 0x00000000 0x00000000 0x00000000 0x00000000 
0x4aeb25b0: 0x00000000 0x00000000 0x00000000 0x00000000 0x00000000 0x00000000 0x00000000 0x00000000 
0x4aeb25d0: 0x00000000 0x00000000 0x00000000 0x00000000 0x00000000 0x00000000 0x00000000 0x00000000 
0x4aeb25f0: 0x00000000 0x00000000 0x00000000 0x4aeb24fc 0x00000000 0x00000000 0x00000000 0x00000000 
0x4aeb2610: 0x00000000 0x00000000 0x00000000 0x00000000 0x00000000 0x00000000 0x00000000 0x00000000 
0x4aeb2630: 0x00000000 0x00000000 0x00000000 0x00000000 0x00000000 0x00000000 0x00000000 0x00000000 
0x4aeb2650: 0x00000000 0x00000000 0x00000000 0x00000000 0x00000000 0x00000000 0x00000000 0x00000000 
0x4aeb2670: 0x00000000 0x00000000 0x00000000 0x00000001 0x00000000 0x00000000 0x00000000 0x4aeb2490 
0x4aeb2690: 0x00000000 0x00000000 0x00000000 0x40129704 0x00782c48 0x00000000 0x00000000 0x00000000 
0x4aeb26b0: 0x00000000 0x00000000 0x00000000 0x00000000 0x00000000 0x00000000 0x00000000 0x00000000 
0x4aeb26d0: 0x00000000 0x00000000 0x00000000 0x00000000 0x00000000 0x00000000 0x00000000 0x00000000 
0x4aeb26f0: 0x00000000 0x00000000 0x00000000 0x00000000 0x00000000 0x00000000 0x00000000 0x00000000 
0x4aeb2710: 0x4a6b3000 0x00800000 0x00001000 0x00001000 0x00000000 0x00000005 0x00000002 0x000802c1 
0x4aeb2730: 0x00000001 0x35000002 0xb99da8c0 0x00000000 0x00000000 0x00000000 0x00000000 0x00000000 
0x4aeb2750: 0x00000000 0x00000000 0x00000000 0x00000000 0x00000000 0x000003e1 0x4aeb2784 0x00000000 
0x4aeb2770: 0x00000000 0x00000000 0x00000000 0x00000000 0x00000000 0x00000000 0x00000000 0x00000000 
0x4aeb2790: 0x00000000 0x00000000 0x00000000 0x00000000 0x00000000 0x00000000 0x00000000 0x00000000 
0x4aeb27b0: 0x00000000 0x00000000 0x00000000 0x00000000 0x00000000 0x00000000 0x00000000 0x00000000 
0x4aeb27d0: 0x00000000 0x00000000 0x00000000 0x00000000 0x00000000 0x00000000 0x00000000 0x00000000 
0x4aeb27f0: 0x00000000 0x00000000 0x00000000 0x00000000 0x00000000 0x00000000 0x00000000 0x00000000 
0x4aeb2810: 0x00000000 0x00000000 0x00000000 0x00000000 0x00000000 0x00000000 0x00000000 0x00000000 
0x4aeb2830: 0x00000000 0x00000000 0x00000000 0x00000000 0x00000000 0x00000000 0x00000000 0x00000000 
0x4aeb2850: 0x00000000 0x00000000 0x00000000 0x00000000 0x00000000 0x00000000 0x00000000 0x00000000 
0x4aeb2870: 0x00000000 0x00000000 0x00000000 0x00000000 0x00000000 0x00000000 0x00000001 0x00000000 
0x4aeb2890: 0x00000000 0x00000000 0x00000000 0x00000000 0x00000000 0x00000000 0x00000000 0x00000000 
0x4aeb28b0: 0x00000000 0x00000000 0x00000000 0x00000000 0x00000000 0x00000000 0x00000000 0x00000000 
0x4aeb28d0: 0x00000000 0x00000000 0x00000000 0x00000000 0x00000000 0x00000000 0xffffffff 0x00000000 
0x4aeb28f0: 0x00030000 0x00030003 0x00000000 0x00000000 0x00000000 0x00000000 0x00000000 0x00000000 
0x4aeb2910: 0x00000000 0x00000000 0x00000000 0x00000000 0x00000000 0x00000000 0x00000000 0x00000000 
0x4aeb2930: 0x007837f0 0x00000000 0x406a14d0 0x4aeb2724 0x00000000 0x4067b3a0 0x00000000 0x4067c1a0 
0x4aeb2950: 0x406a203c 0x00000000 0x00000000 0x00000000 0x00000000 0x00000000 0x00000000 0x00000000 
0x4aeb2970: 0x00000000 0x00000000 0x00000000 0x00000000 0x00000000 0x00000000 0x00000000 0x00000000 
0x4aeb2990: 0x00000000 0x00000000 0x00000000 0x00000000 0x00000000 0x00000000 0x00000000 0x00000000 
0x4aeb29b0: 0x00000000 0x00000000 0x00000000 0x00000000 0x00000000 0x00000000 0x00000000 0x00000000 
0x4aeb29d0: 0x00000000 0x00000000 0x00000000 0x00000000 0x00000000 0x00000000 0x00000000 0x00000000 
0x4aeb29f0: 0x00000000 0x00000000 0x00000000 0x00000000 0x00000000 0x00000000 0x00000000 0x00000000 
0x4aeb2a10: 0x00000000 0x00000000 0x00000000 0x00000000 0x00000000 0x00000000 0x00000000 0x00000000 
0x4aeb2a30: 0x00000000 0x00000000 0x00000000 0x00000000 0x00000000 0x00000000 0x00000000 0x00000000 
0x4aeb2a50: 0x00000000 0x00000000 0x00000000 0x00000000 0x00000000 0x00000000 0x00000000 0x00000000 
0x4aeb2a70: 0x00000000 0x00000000 0x00000000 0x00000000 0x00000000 0x00000000 0x00000000 0x00000000 
0x4aeb2a90: 0x00000000 0x00000000 0x00000000 0x00000000 0x00000000 0x00000000 0x00000000 0x00000000 
0x4aeb2ab0: 0x00000000 0x00000000 0x00000000 0x00000000 0x00000000 0x00000000 0x00000000 0x00000000 
0x4aeb2ad0: 0x00000000 0x00000000 0x00000000 0x00000000 0x00000000 0x00000000 0x00000000 0x00000000 
0x4aeb2af0: 0x00000000 0x00000000 0x00000000 0x00000000 0x00000000 0x00000000 0x00000000 0x00000000 
0x4aeb2b10: 0x00000000 0x00000000 0x00000000 0x00000000 0x00000000 0x00000000 0x00000000 0x00000000 
0x4aeb2b30: 0x00000000 0x00000000 0x00000000 0x00000000 0x00000000 0x00000000 0x00000000 0x00000000 
0x4aeb2b50: 0x00000000 0x00000000 0x00000000 0x00000000 0x00000000 0x00000000 0x00000000 0x00000000 
0x4aeb2b70: 0x00000000 0x00000000 0x00000000 0x00000000 0x00000000 0x00000000 0x00000000 0x00000000 
0x4aeb2b90: 0x00000000 0x00000000 0x00000000 0x00000000 0x00000000 0x00000000 0x00000000 0x00000000 
0x4aeb2bb0: 0x00000000 0x00000000 0x00000000 0x00000000 0x00000000 0x00000000 0x00000000 0x00000000 
0x4aeb2bd0: 0x00000000 0x00000000 0x00000000 0x00000000 0x00000000 0x00000000 0x00000000 0x00000000 
0x4aeb2bf0: 0x00000000 0x00000000 0x00000000 0x00000000 0x00000000 0x00000000 0x00000000 0x00000000 
0x4aeb2c10: 0x00000000 0x00000000 0x00000000 0x00000000 0x00000000 0x00000000 0x00000000 0x00000000 
0x4aeb2c30: 0x00000000 0x00000000 0x00000000 0x00000000 0x00000000 0x00000000 0x00000000 0x00000000 
0x4aeb2c50: 0x00000000 0x00000000 0x00000000 0x00000000 0x00000000 0x00000000 0x00000000 0x00000000 
0x4aeb2c70: 0x00000000 0x00000000 0x00000000 0x00000000 0x00000000 0x00000000 0x00000000 0x00000000 
0x4aeb2c90: 0x00000000 0x00000000 0x00000000 0x00000000 0x00000000 0x00000000 0x00000000 0x00000000 
0x4aeb2cb0: 0x00000000 0x00000000 0x00000000 0x00000000 0x00000000 0x00000000 0x00000000 0x00000000 
0x4aeb2cd0: 0x00000000 0x00000000 0x00000000 0x00000000 0x00000000 0x00000000 0x00000000 0x00000000 
0x4aeb2cf0: 0x00000000 0x00000000 0x00000000 0x00000000 0x00000000 0x00000000 0x00000000 0x00000000 
0x4aeb2d10: 0x00000000 0x00000000 0x00000000 0x00000000 0x00000000 0x00000000 0x00000000 0x00000000 
0x4aeb2d30: 0x00000000 0x00000000 0x00000000 0x00000000 0x00000000 0x00000000 0x00000000 0x00000000 
0x4aeb2d50: 0x00000000 0x00000000 0x00000000 0x00000000 0x00000000 0x00000000 0x00000000 0x00000000 
0x4aeb2d70: 0x00000000 0x00000000 0x00000000 0x00000000 0x00000000 0x00000000 0x00000000 0x00000000 
0x4aeb2d90: 0x00000000 0x00000000 0x00000000 0x00000000 0x00000000 0x00000000 0x00000000 0x00000000 
0x4aeb2db0: 0x00000000 0x00000000 0x00000000 0x00000000 0x00000000 0x00000000 0x00000000 0x00000000 
0x4aeb2dd0: 0x00000000 0x00000000 0x00000000 0x00000000 0x00000000 0x00000000 0x00000000 0x00000000 
0x4aeb2df0: 0x00000000 0x00000000 0x00000000 0x00000000 0x00000000 0x00000000 0x00000000 0x00000000 
0x4aeb2e10: 0x00000000 0x00000000 0x00000000 0x00000000 0x00000000 0x00000000 0x00000000 0x00000000 
0x4aeb2e30: 0x00000000 0x00000000 0x00000000 0x00000000 0x00000000 0x00000000 0x00000000 0x00000000 
0x4aeb2e50: 0x00000000 0x00000000 0x00000000 0x00000000 0x00000000 0x00000000 0x00000000 0x00000000 
0x4aeb2e70: 0x00000000 0x00000000 0x00000000 0x00000000 0x00000000 0x00000000 0x00000000 0x00000000 
0x4aeb2e90: 0x00000000 0x00000000 0x00000000 0x00000000 0x00000000 0x00000000 0x00000000 0x00000000 
0x4aeb2eb0: 0x00000000 0x00000000 0x00000000 0x00000000 0x00000000 0x00000000 0x00000000 0x00000000 
0x4aeb2ed0: 0x00000000 0x00000000 0x00000000 0x00000000 0x00000000 0x00000000 0x00000000 0x00000000 
0x4aeb2ef0: 0x00000000 0x00000000 0x00000000 0x00000000 0x00000000 0x00000000 0x00000000 0x00000000 
0x4aeb2f10: 0x00000000 0x00000000 0x00000000 0x00000000 0x00000000 0x00000000 0x00000000 0x00000000 
0x4aeb2f30: 0x00000000 0x00000000 0x00000000 0x00000000 0x00000000 0x00000000 0x00000000 0x00000000 
0x4aeb2f50: 0x00000000 0x00000000 0x00000000 0x00000000 0x00000000 0x00000000 0x00000000 0x00000000 
0x4aeb2f70: 0x00000000 0x00000000 0x00000000 0x00000000 0x00000000 0x00000000 0x00000000 0x00000000 
0x4aeb2f90: 0x00000000 0x00000000 0x00000000 0x00000000 0x00000000 0x00000000 0x00000000 0x00000000 
0x4aeb2fb0: 0x00000000 0x00000000 0x00000000 0x00000000 0x00000000 0x00000000 0x00000000 0x00000000 
0x4aeb2fd0: 0x00000000 0x00000000 0x00000000 0x00000000 0x00000000 0x00000000 0x00000000 0x00000000 
0x4aeb2ff0: 0x00000000 0x00000000 0x00000000 0x00000000 



Stack unwind
============

---------------------------------------------------------------------------------------------------
 Function   Return    Frame
 Address    Address   Pointer

Signal SIGBUS (7, 0x00000080) occurred in Crash Handler :-(

Aborting crash dump

